{
  "id": "threatBA09_SecurityIssuesOfSLA",
  "metadata": {
    "ns:textReviewContext": "Compliance manager works with cloud application",
    "ns:textName": "BA09 Security Issues Of SLA",
    "ns:textReviewSolution": "",
    "ns:textURL": "",
    "ns:textReviewProblem": "Incorrect or unclear information security section of SLA",
    "ns:textReference": "OI-4: Issues emerging because of poor SLA specification [SECCRIT]; V.31: Lack of completeness and transparency in terms of use [ENISA]; V.23: SLA clauses with conflicting promises to different stakeholders [ENISA]; V.24: SLA clauses containing excessive business risk [ENISA]"
  },
  "organization": {
    "ns:usesPattern": [],
    "ns:hasGroup": [],
    "ns:hasType": ["ns:type_ThreatPattern"],
    "ns:hasTemplate": [],
    "ns:relatesTo": [],
    "ns:isChildOf": []
  },
  "common": {
    "ns:hasArchitecturalLayer": [],
    "ns:hasResponseType": [],
    "ns:hasDomain": [],
    "ns:hasSecurityLevel": [],
    "ns:hasLifecycleStage": [],
    "ns:hasConstraintLevel": []
  },
  "context": {
    "ns:hasAffectedFunction": [],
    "ns:hasAffectedComponent": ["su:comp_CloudApplication"]
  },
  "security": {
    "ns:hasThreat": [],
    "ns:hasAggressor": ["su:comp_ComplianceManager"],
    "ns:hasAggressorRole": ["ns:role_Client"],
    "ns:hasWeakness": [],
    "ns:hasSTRIDE": [],
    "ns:hasSecurityConcern": []
  }
}