{
  "id": "threatBA12_ConfiscationOfComputerHardware",
  "metadata": {
    "ns:textReviewContext": "Compliance manager works with cloud application",
    "ns:textName": "BA12 Confiscation Of Computer Hardware",
    "ns:textReviewSolution": "",
    "ns:textURL": "",
    "ns:textReviewProblem": "Confiscation of computer hardware of cloud provider as a result of subpoena by law-enforcement agencies",
    "ns:textReference": "R.21: Subpoena and  Eâ€“Discovery [ENISA]"
  },
  "organization": {
    "ns:usesPattern": [],
    "ns:hasGroup": [],
    "ns:hasType": ["ns:type_ThreatPattern"],
    "ns:hasTemplate": [],
    "ns:relatesTo": [],
    "ns:isChildOf": []
  },
  "common": {
    "ns:hasArchitecturalLayer": [],
    "ns:hasResponseType": [],
    "ns:hasDomain": [],
    "ns:hasSecurityLevel": [],
    "ns:hasLifecycleStage": [],
    "ns:hasConstraintLevel": []
  },
  "context": {
    "ns:hasAffectedFunction": [],
    "ns:hasAffectedComponent": ["su:comp_CloudApplication"]
  },
  "security": {
    "ns:hasThreat": [],
    "ns:hasAggressor": ["su:comp_ComplianceManager"],
    "ns:hasAggressorRole": ["ns:role_Client"],
    "ns:hasWeakness": [],
    "ns:hasSTRIDE": ["ns:STRIDE_Information_Disclosure","ns:STRIDE_Denial_of_Service"],
    "ns:hasSecurityConcern": []
  }
}