{
  "id": "threatBA11_SoftwareLicenseIssues",
  "metadata": {
    "ns:textReviewContext": "Compliance manager works with cloud application",
    "ns:textName": "BA11 Software License Issues",
    "ns:textReviewSolution": "",
    "ns:textURL": "",
    "ns:textReviewProblem": "Software license issues",
    "ns:textReference": "R.24: Licensing risks [ENISA]; TIS.064 [BDU]"
  },
  "organization": {
    "ns:usesPattern": [],
    "ns:hasGroup": [],
    "ns:hasType": ["ns:type_ThreatPattern"],
    "ns:hasTemplate": [],
    "ns:relatesTo": [],
    "ns:isChildOf": []
  },
  "common": {
    "ns:hasArchitecturalLayer": [],
    "ns:hasResponseType": [],
    "ns:hasDomain": [],
    "ns:hasSecurityLevel": [],
    "ns:hasLifecycleStage": [],
    "ns:hasConstraintLevel": []
  },
  "context": {
    "ns:hasAffectedFunction": [],
    "ns:hasAffectedComponent": ["su:comp_CloudApplication"]
  },
  "security": {
    "ns:hasThreat": [],
    "ns:hasAggressor": ["su:comp_ComplianceManager"],
    "ns:hasAggressorRole": ["ns:role_Client"],
    "ns:hasWeakness": [],
    "ns:hasSTRIDE": [],
    "ns:hasSecurityConcern": []
  }
}