{
  "id": "threatBA04_HiddenDependenciesOfCloudInfrastructure",
  "metadata": {
    "ns:textReviewContext": "Compliance manager works with cloud application",
    "ns:textName": "BA04 Hidden Dependencies Of Cloud Infrastructure",
    "ns:textReviewSolution": "",
    "ns:textURL": "",
    "ns:textReviewProblem": "Hidden dependencies between components of cloud application and cloud infrastructure cause security issues of cloud application",
    "ns:textReference": "R.7: Supply chain failure [ENISA]"
  },
  "organization": {
    "ns:usesPattern": [],
    "ns:hasGroup": [],
    "ns:hasType": ["ns:type_ThreatPattern"],
    "ns:hasTemplate": [],
    "ns:relatesTo": [],
    "ns:isChildOf": []
  },
  "common": {
    "ns:hasArchitecturalLayer": [],
    "ns:hasResponseType": [],
    "ns:hasDomain": [],
    "ns:hasSecurityLevel": [],
    "ns:hasLifecycleStage": [],
    "ns:hasConstraintLevel": []
  },
  "context": {
    "ns:hasAffectedFunction": [],
    "ns:hasAffectedComponent": ["su:comp_CloudApplication"]
  },
  "security": {
    "ns:hasThreat": [],
    "ns:hasAggressor": ["su:comp_ComplianceManager"],
    "ns:hasAggressorRole": ["ns:role_Client"],
    "ns:hasWeakness": [],
    "ns:hasSTRIDE": ["ns:STRIDE_Denial_of_Service"],
    "ns:hasSecurityConcern": []
  }
}