{
  "id": "threatAC01_MalwareFromCloudApplication",
  "metadata": {
    "ns:textReviewContext": "Remote user interacts with a cloud application",
    "ns:textName": "AC01 Malware From Cloud Application",
    "ns:textReviewSolution": "Apply antivirus software (Remote user); Apply malware scan (cloud application);",
    "ns:textURL": "",
    "ns:textReviewProblem": "Malicious content (malware) from the cloud application (affects remote user)"
  },
  "organization": {
    "ns:usesPattern": [],
    "ns:hasGroup": [],
    "ns:hasType": ["ns:type_ThreatPattern"],
    "ns:hasTemplate": [],
    "ns:relatesTo": [],
    "ns:isChildOf": []
  },
  "common": {
    "ns:hasArchitecturalLayer": [],
    "ns:hasResponseType": [],
    "ns:hasDomain": [],
    "ns:hasSecurityLevel": [],
    "ns:hasLifecycleStage": [],
    "ns:hasConstraintLevel": []
  },
  "context": {
    "ns:hasAffectedFunction": [],
    "ns:hasAffectedComponent": ["su:comp_RemoteUser"]
  },
  "security": {
    "ns:hasThreat": [],
    "ns:hasAggressor": ["su:comp_CloudApplication"],
    "ns:hasAggressorRole": ["ns:role_Server"],
    "ns:hasWeakness": [],
    "ns:hasSTRIDE": [],
    "ns:hasSecurityConcern": []
  }
}