{
  "id": "threatAD07_LogOfCloudApplicationLost",
  "metadata": {
    "ns:textReviewContext": "Someone interacts with a cloud application",
    "ns:textName": "AD07 Log Of Cloud Application Lost",
    "ns:textReviewSolution": "Apply third-part log service",
    "ns:textURL": "",
    "ns:textReviewProblem": "Lost of cloud application log",
    "ns:textReference": "R30, R.31 Lost or compromise of operational or security logs [ENISA]"
  },
  "organization": {
    "ns:usesPattern": [],
    "ns:hasGroup": [],
    "ns:hasType": ["ns:type_ThreatPattern"],
    "ns:hasTemplate": [],
    "ns:relatesTo": [],
    "ns:isChildOf": []
  },
  "common": {
    "ns:hasArchitecturalLayer": [],
    "ns:hasResponseType": [],
    "ns:hasDomain": [],
    "ns:hasSecurityLevel": [],
    "ns:hasLifecycleStage": [],
    "ns:hasConstraintLevel": []
  },
  "context": {
    "ns:hasAffectedFunction": [],
    "ns:hasAffectedComponent": ["su:comp_CloudApplication"]
  },
  "security": {
    "ns:hasThreat": [],
    "ns:hasAggressor": ["su:comp_CloudApplication", "su:comp_ExternalService", "su:comp_RemoteUser"],
    "ns:hasAggressorRole": ["ns:role_Client"],
    "ns:hasWeakness": [],
    "ns:hasSTRIDE": ["ns:STRIDE_Repudiation"],
    "ns:hasSecurityConcern": []
  }
}