{
  "id": "threatAE02_EDoSAttackToCloudApplication",
  "metadata": {
    "ns:textReviewContext": "Remote user interacts with a cloud application",
    "ns:textName": "AE02 EDoS Attack To Cloud Application",
    "ns:textReviewSolution": "",
    "ns:textURL": "",
    "ns:textReviewProblem": "EDoS (Economic Denial of Sustainability or Economic Denial of Service) attack against cloud application from the Internet",
    "ns:textReference": "MS-3: An attack that leads to an excessive use of resources that are billed for, resulting in an Economic Denial of Service (E-DoS) [SECCRIT]; R.16: ECONOMIC DENIAL OF SERVICE (EDOS) [ENISA]; Economic Denial of Service [QUIRC]; Economic Durability [Rath]"
  },
  "organization": {
    "ns:usesPattern": [],
    "ns:hasGroup": [],
    "ns:hasType": ["ns:type_ThreatPattern"],
    "ns:hasTemplate": [],
    "ns:relatesTo": [],
    "ns:isChildOf": []
  },
  "common": {
    "ns:hasArchitecturalLayer": [],
    "ns:hasResponseType": [],
    "ns:hasDomain": [],
    "ns:hasSecurityLevel": [],
    "ns:hasLifecycleStage": [],
    "ns:hasConstraintLevel": []
  },
  "context": {
    "ns:hasAffectedFunction": [],
    "ns:hasAffectedComponent": ["su:comp_CloudApplication"]
  },
  "security": {
    "ns:hasThreat": [],
    "ns:hasAggressor": ["su:comp_RemoteUser"],
    "ns:hasAggressorRole": ["ns:role_Client"],
    "ns:hasWeakness": [],
    "ns:hasSTRIDE": ["ns:STRIDE_Denial_of_Service"],
    "ns:hasSecurityConcern": []
  }
}