{
  "id": "threatAD05_BackupOfCloudApplicationLost",
  "metadata": {
    "ns:textReviewContext": "Someone interacts with a cloud application",
    "ns:textName": "AD05 Backup Of CloudApplication Lost",
    "ns:textReviewSolution": "",
    "ns:textURL": "",
    "ns:textReviewProblem": "Lost of cloud application backup",
    "ns:textReference": "R.32: BACKUPS LOST, STOLEN [ENISA]; Data Retention [Rath]"
  },
  "organization": {
    "ns:usesPattern": [],
    "ns:hasGroup": [],
    "ns:hasType": ["ns:type_ThreatPattern"],
    "ns:hasTemplate": [],
    "ns:relatesTo": [],
    "ns:isChildOf": []
  },
  "common": {
    "ns:hasArchitecturalLayer": [],
    "ns:hasResponseType": [],
    "ns:hasDomain": [],
    "ns:hasSecurityLevel": [],
    "ns:hasLifecycleStage": [],
    "ns:hasConstraintLevel": []
  },
  "context": {
    "ns:hasAffectedFunction": [],
    "ns:hasAffectedComponent": ["su:comp_CloudApplication"]
  },
  "security": {
    "ns:hasThreat": [],
    "ns:hasAggressor": ["su:comp_CloudApplication", "su:comp_ExternalService", "su:comp_RemoteUser"],
    "ns:hasAggressorRole": ["ns:role_Client"],
    "ns:hasWeakness": [],
    "ns:hasSTRIDE": ["ns:STRIDE_Denial_of_Service"],
    "ns:hasSecurityConcern": []
  }
}