{
  "id": "threatAE01_DDoSAttackToCloudApplication",
  "metadata": {
    "ns:textReviewContext": "Remote user interacts with a cloud application",
    "ns:textName": "AE01 DDoS Attack To Cloud Application",
    "ns:textReviewSolution": "",
    "ns:textURL": "",
    "ns:textReviewProblem": "DDoS/DoS attack against cloud application from the Internet",
    "ns:textReference": "BNA-2: Denial of Service (DoS) attack against the cloud infrastructure via the public network infrastructure [SECCRIT]; R.15: Distributed Denial Of Service (DDoS) [ENISA]; Distributed Denial of Service [QUIRC];"
  },
  "organization": {
    "ns:usesPattern": [],
    "ns:hasGroup": [],
    "ns:hasType": ["ns:type_ThreatPattern"],
    "ns:hasTemplate": [],
    "ns:relatesTo": [],
    "ns:isChildOf": []
  },
  "common": {
    "ns:hasArchitecturalLayer": [],
    "ns:hasResponseType": [],
    "ns:hasDomain": [],
    "ns:hasSecurityLevel": [],
    "ns:hasLifecycleStage": [],
    "ns:hasConstraintLevel": []
  },
  "context": {
    "ns:hasAffectedFunction": [],
    "ns:hasAffectedComponent": ["su:comp_CloudApplication"]
  },
  "security": {
    "ns:hasThreat": [],
    "ns:hasAggressor": ["su:comp_RemoteUser"],
    "ns:hasAggressorRole": ["ns:role_Client"],
    "ns:hasWeakness": [],
    "ns:hasSTRIDE": ["ns:STRIDE_Denial_of_Service"],
    "ns:hasSecurityConcern": []
  }
}