{
  "id": "threatAE05_BlockSharedResourcesOfCloudApplication",
  "metadata": {
    "ns:textReviewContext": "Remote user interacts with a cloud application",
    "ns:textName": "AE05 Block Shared Resources Of Cloud Application",
    "ns:textReviewSolution": "Ensure strict division identifiers (names, IP addresses) of cloud infrastructure;",
    "ns:textURL": "",
    "ns:textReviewProblem": "Blocking shared resources of cloud application (e.g. shared external IP) by a third-part reputation service",
    "ns:textReference": ""
  },
  "organization": {
    "ns:usesPattern": [],
    "ns:hasGroup": [],
    "ns:hasType": ["ns:type_ThreatPattern"],
    "ns:hasTemplate": [],
    "ns:relatesTo": [],
    "ns:isChildOf": []
  },
  "common": {
    "ns:hasArchitecturalLayer": [],
    "ns:hasResponseType": [],
    "ns:hasDomain": [],
    "ns:hasSecurityLevel": [],
    "ns:hasLifecycleStage": [],
    "ns:hasConstraintLevel": []
  },
  "context": {
    "ns:hasAffectedFunction": [],
    "ns:hasAffectedComponent": ["su:comp_CloudApplication"]
  },
  "security": {
    "ns:hasThreat": [],
    "ns:hasAggressor": ["su:comp_RemoteUser"],
    "ns:hasAggressorRole": ["ns:role_Client"],
    "ns:hasWeakness": [],
    "ns:hasSTRIDE": ["ns:STRIDE_Denial_of_Service"],
    "ns:hasSecurityConcern": []
  }
}